[
  {
    "tenant_id": "platform-team",
    "repository": "KingsMtn/SMERC-Runtime-Permission-Layer",
    "repository_id": "1274598343",
    "repository_owner_id": "293280548",
    "subjects": [
      "repo:KingsMtn/SMERC-Runtime-Permission-Layer:environment:production"
    ],
    "refs": ["refs/heads/main"],
    "workflow_refs": [
      "KingsMtn/SMERC-Runtime-Permission-Layer/.github/workflows/remote_example_workflow.yml@refs/heads/main"
    ],
    "workflow_shas": ["276b4ae3a30f9852644d7c7f5bf43833ba43f017"],
    "events": ["workflow_dispatch"],
    "environments": ["production"],
    "scopes": ["actions.evaluate"],
    "runner_environments": ["github-hosted"]
  }
]
